{
  "$schema": "../schema/lab-definition.schema.json",
  "schemaVersion": 2,
  "demo": "olympus",
  "displayName": "Olympus Systems",
  "domain": {
    "dnsName": "ad.olympus.test",
    "legacyDnsName": "olympus.local",
    "netbiosName": "OLYMPUS",
    "baseOrganizationalUnit": "Olympus Systems"
  },
  "networks": {
    "production": { "cidr": "10.20.10.0/24", "gateway": "10.20.10.1", "dnsServers": ["10.20.10.10", "10.20.10.11"], "description": "Domain and member servers" },
    "management": { "cidr": "10.20.100.0/24", "gateway": "10.20.100.1", "dnsServers": ["10.20.10.10", "10.20.10.11"], "description": "Administrative access" },
    "client": { "cidr": "10.20.20.0/24", "gateway": "10.20.20.1", "dnsServers": ["10.20.10.10", "10.20.10.11"], "description": "Standard workstations" },
    "dmz": { "cidr": "10.20.50.0/24", "gateway": "10.20.50.1", "dnsServers": ["10.20.10.10", "10.20.10.11"], "description": "External-facing services" },
    "aiml": { "cidr": "10.20.60.0/24", "gateway": "10.20.60.1", "dnsServers": ["10.20.10.10", "10.20.10.11"], "description": "AI and machine-learning workstations" }
  },
  "departments": ["Divine Council", "War Strategists", "Innovation Forge", "Abundance Treasury", "Harmony Relations"],
  "virtualMachines": [
    { "id": 5200, "name": "ZEUS-DC01", "role": "primary-dc", "os": "server-2025", "profiles": ["smoke", "core", "full"], "profileResourceOverrides": { "smoke": { "cores": 2, "memoryMB": 3072, "diskGB": 64, "balloonMinimumMB": 2560 } }, "profileNicOverrides": { "smoke": [{ "network": "production", "ipAddress": "10.20.10.10", "prefixLength": 24, "defaultGateway": true }] }, "bootOrder": 10, "cores": 4, "memoryMB": 8192, "diskGB": 100, "nics": [{ "network": "production", "ipAddress": "10.20.10.10", "prefixLength": 24, "defaultGateway": true }, { "network": "management", "ipAddress": "10.20.100.10", "prefixLength": 24 }] },
    { "id": 5201, "name": "HERA-DC02", "role": "secondary-dc", "os": "server-2025", "profiles": ["smoke", "core", "full"], "profileResourceOverrides": { "smoke": { "cores": 2, "memoryMB": 3072, "diskGB": 64, "balloonMinimumMB": 2560 } }, "profileNicOverrides": { "smoke": [{ "network": "production", "ipAddress": "10.20.10.11", "prefixLength": 24, "defaultGateway": true }] }, "bootOrder": 20, "cores": 4, "memoryMB": 8192, "diskGB": 100, "nics": [{ "network": "production", "ipAddress": "10.20.10.11", "prefixLength": 24, "defaultGateway": true }, { "network": "management", "ipAddress": "10.20.100.11", "prefixLength": 24 }] },
    { "id": 5202, "name": "HERMES-FS01", "role": "file-server", "os": "server-2025", "profiles": ["smoke", "core", "full"], "profileResourceOverrides": { "smoke": { "cores": 2, "memoryMB": 2560, "diskGB": 120, "balloonMinimumMB": 2048 } }, "profileNicOverrides": { "smoke": [{ "network": "production", "ipAddress": "10.20.10.20", "prefixLength": 24, "defaultGateway": true }] }, "bootOrder": 30, "cores": 4, "memoryMB": 12288, "diskGB": 1000, "nics": [{ "network": "production", "ipAddress": "10.20.10.20", "prefixLength": 24, "defaultGateway": true }, { "network": "management", "ipAddress": "10.20.100.20", "prefixLength": 24 }] },
    { "id": 5203, "name": "APOLLO-WEB01", "role": "web-server", "os": "server-2025", "profiles": ["smoke", "core", "full"], "profileResourceOverrides": { "smoke": { "cores": 1, "memoryMB": 2048, "diskGB": 64, "balloonMinimumMB": 2048 } }, "profileNicOverrides": { "smoke": [{ "network": "production", "ipAddress": "10.20.10.30", "prefixLength": 24, "defaultGateway": true }] }, "bootOrder": 40, "cores": 4, "memoryMB": 8192, "diskGB": 200, "nics": [{ "network": "production", "ipAddress": "10.20.10.30", "prefixLength": 24, "defaultGateway": true }, { "network": "dmz", "ipAddress": "10.20.50.30", "prefixLength": 24 }] },
    { "id": 5204, "name": "ATHENA-SEC01", "role": "management-server", "os": "server-2025", "profiles": ["smoke", "core", "full"], "profileResourceOverrides": { "smoke": { "cores": 2, "memoryMB": 2560, "diskGB": 64, "balloonMinimumMB": 2048 } }, "profileNicOverrides": { "smoke": [{ "network": "production", "ipAddress": "10.20.10.40", "prefixLength": 24, "defaultGateway": true }] }, "bootOrder": 40, "cores": 4, "memoryMB": 8192, "diskGB": 200, "nics": [{ "network": "production", "ipAddress": "10.20.10.40", "prefixLength": 24, "defaultGateway": true }, { "network": "management", "ipAddress": "10.20.100.40", "prefixLength": 24 }] },
    { "id": 5210, "name": "ZEUS-WS01", "role": "client", "os": "windows-11", "profiles": ["smoke", "core", "full"], "profileResourceOverrides": { "smoke": { "cores": 2, "memoryMB": 4096, "diskGB": 80, "balloonMinimumMB": 3072 } }, "profileNicOverrides": { "smoke": [{ "network": "production", "ipAddress": "10.20.10.50", "prefixLength": 24, "defaultGateway": true }] }, "bootOrder": 50, "cores": 2, "memoryMB": 4096, "diskGB": 80, "department": "Divine Council", "user": { "samAccountName": "zeus.supreme", "displayName": "Zeus Supreme", "title": "Chief Executive Officer", "privileged": true }, "nics": [{ "network": "client", "ipAddress": "10.20.20.10", "prefixLength": 24, "defaultGateway": true }] },
    { "id": 5211, "name": "HERMES-WS01", "role": "client", "os": "windows-11", "profiles": ["core", "full"], "bootOrder": 50, "cores": 2, "memoryMB": 4096, "diskGB": 80, "department": "Divine Council", "user": { "samAccountName": "hermes.messenger", "displayName": "Hermes Messenger", "title": "Senior Systems Engineer" }, "nics": [{ "network": "client", "ipAddress": "10.20.20.11", "prefixLength": 24, "defaultGateway": true }] },
    { "id": 5212, "name": "HADES-WS01", "role": "client", "os": "windows-11", "profiles": ["full"], "bootOrder": 50, "cores": 2, "memoryMB": 4096, "diskGB": 80, "department": "Divine Council", "user": { "samAccountName": "hades.database", "displayName": "Hades Database", "title": "Database Administrator" }, "nics": [{ "network": "client", "ipAddress": "10.20.20.12", "prefixLength": 24, "defaultGateway": true }] },
    { "id": 5213, "name": "POSEIDON-WS01", "role": "client", "os": "windows-11", "profiles": ["full"], "bootOrder": 50, "cores": 2, "memoryMB": 4096, "diskGB": 80, "department": "Divine Council", "user": { "samAccountName": "poseidon.network", "displayName": "Poseidon Network", "title": "Network Administrator" }, "nics": [{ "network": "client", "ipAddress": "10.20.20.13", "prefixLength": 24, "defaultGateway": true }] },
    { "id": 5214, "name": "DIONYSUS-WS01", "role": "client", "os": "windows-11", "profiles": ["full"], "bootOrder": 50, "cores": 2, "memoryMB": 4096, "diskGB": 80, "department": "Divine Council", "user": { "samAccountName": "dionysus.developer", "displayName": "Dionysus Developer", "title": "Senior Developer" }, "nics": [{ "network": "client", "ipAddress": "10.20.20.14", "prefixLength": 24, "defaultGateway": true }] },
    { "id": 5215, "name": "ARES-WS01", "role": "client", "os": "windows-11", "profiles": ["full"], "bootOrder": 50, "cores": 2, "memoryMB": 4096, "diskGB": 80, "department": "War Strategists", "user": { "samAccountName": "ares.ciso", "displayName": "Ares Strategist", "title": "Chief Information Security Officer" }, "nics": [{ "network": "client", "ipAddress": "10.20.20.15", "prefixLength": 24, "defaultGateway": true }] },
    { "id": 5216, "name": "KRATOS-WS01", "role": "client", "os": "windows-11", "profiles": ["full"], "bootOrder": 50, "cores": 2, "memoryMB": 4096, "diskGB": 80, "department": "War Strategists", "user": { "samAccountName": "kratos.architect", "displayName": "Kratos Architect", "title": "Security Architect" }, "nics": [{ "network": "client", "ipAddress": "10.20.20.16", "prefixLength": 24, "defaultGateway": true }] },
    { "id": 5217, "name": "NIKE-WS01", "role": "client", "os": "windows-11", "profiles": ["full"], "bootOrder": 50, "cores": 2, "memoryMB": 4096, "diskGB": 80, "department": "War Strategists", "user": { "samAccountName": "nike.soc", "displayName": "Nike SOC", "title": "SOC Analyst Lead" }, "nics": [{ "network": "client", "ipAddress": "10.20.20.17", "prefixLength": 24, "defaultGateway": true }] },
    { "id": 5218, "name": "BIA-WS01", "role": "client", "os": "windows-11", "profiles": ["full"], "bootOrder": 50, "cores": 2, "memoryMB": 4096, "diskGB": 80, "department": "War Strategists", "user": { "samAccountName": "bia.hunter", "displayName": "Bia Hunter", "title": "Threat Hunter" }, "nics": [{ "network": "client", "ipAddress": "10.20.20.18", "prefixLength": 24, "defaultGateway": true }] },
    { "id": 5219, "name": "ZELUS-WS01", "role": "client", "os": "windows-11", "profiles": ["full"], "bootOrder": 50, "cores": 2, "memoryMB": 4096, "diskGB": 80, "department": "War Strategists", "user": { "samAccountName": "zelus.compliance", "displayName": "Zelus Compliance", "title": "Compliance Officer" }, "nics": [{ "network": "client", "ipAddress": "10.20.20.19", "prefixLength": 24, "defaultGateway": true }] },
    { "id": 5220, "name": "APOLLO-WS01", "role": "aiml-client", "os": "windows-11", "profiles": ["full"], "bootOrder": 50, "cores": 4, "memoryMB": 8192, "diskGB": 160, "department": "Innovation Forge", "user": { "samAccountName": "apollo.research", "displayName": "Apollo Research", "title": "AI Research Director" }, "nics": [{ "network": "aiml", "ipAddress": "10.20.60.10", "prefixLength": 24, "defaultGateway": true }] },
    { "id": 5221, "name": "ARTEMIS-WS01", "role": "aiml-client", "os": "windows-11", "profiles": ["full"], "bootOrder": 50, "cores": 4, "memoryMB": 8192, "diskGB": 160, "department": "Innovation Forge", "user": { "samAccountName": "artemis.ml", "displayName": "Artemis Machine Learning", "title": "Machine Learning Engineer" }, "nics": [{ "network": "aiml", "ipAddress": "10.20.60.11", "prefixLength": 24, "defaultGateway": true }] },